{
  "$schema": "./questions.schema.json",
  "id": "mock",
  "title": "SC-200 範例題庫",
  "description": "涵蓋單選、複選、KQL 下拉挖空、步驟排序、Yes/No 判斷與情境題組等 SC-200 常見題型的範例資料。",
  "version": "1.0.0",
  "chapters": [
    {
      "id": "ch1",
      "title": "Manage a security operations environment",
      "description": "Microsoft Sentinel 工作區、資料連接器、RBAC 與自動化"
    },
    {
      "id": "ch2",
      "title": "Configure protections and detections",
      "description": "Defender XDR / Defender for Endpoint 防護與自訂偵測"
    },
    {
      "id": "ch3",
      "title": "Manage incident response",
      "description": "事件調查、回應動作與 Playbook"
    },
    {
      "id": "ch4",
      "title": "Manage security threats",
      "description": "KQL 威脅獵捕與 Threat Intelligence"
    }
  ],
  "questions": [
    {
      "id": "q001",
      "type": "single_choice",
      "chapter": "ch3",
      "difficulty": "easy",
      "tags": ["Defender for Endpoint", "Response actions"],
      "question": "You use Microsoft Defender for Endpoint. A device named **Device1** is suspected of being compromised.\n\nYou need to prevent Device1 from communicating with other devices on the network while still allowing it to report to the Defender for Endpoint service.\n\nWhich response action should you perform?",
      "options": [
        { "id": "A", "text": "Run antivirus scan" },
        { "id": "B", "text": "Isolate device" },
        { "id": "C", "text": "Restrict app execution" },
        { "id": "D", "text": "Collect investigation package" }
      ],
      "answer": "B",
      "explanation": "**Isolate device** 會中斷裝置的網路連線，但保留與 Defender for Endpoint 雲端服務的連線，讓分析師仍可持續監控與執行後續動作（例如 Live Response）。\n\n- Restrict app execution：只允許 Microsoft 簽章的程式執行，不會阻斷網路。\n- Collect investigation package：收集鑑識資料，不具隔離效果。",
      "references": [
        {
          "title": "Take response actions on a device",
          "url": "https://learn.microsoft.com/defender-endpoint/respond-machine-alerts"
        }
      ]
    },
    {
      "id": "q002",
      "type": "single_choice",
      "chapter": "ch1",
      "difficulty": "medium",
      "tags": ["Microsoft Sentinel", "RBAC"],
      "question": "You have a Microsoft Sentinel workspace.\n\nTier-1 analysts must be able to assign incidents and change incident status. The solution must follow the principle of least privilege.\n\nWhich role should you assign to the analysts?",
      "options": [
        { "id": "A", "text": "Microsoft Sentinel Reader" },
        { "id": "B", "text": "Microsoft Sentinel Responder" },
        { "id": "C", "text": "Microsoft Sentinel Contributor" },
        { "id": "D", "text": "Logic App Contributor" }
      ],
      "answer": "B",
      "explanation": "**Microsoft Sentinel Responder** 具備 Reader 的所有權限，並可管理事件（指派、變更狀態與嚴重性、加入註解），但不能建立或修改分析規則等內容，符合最小權限原則。\n\nContributor 權限過大；Reader 無法修改事件；Logic App Contributor 用於管理 Playbook。",
      "references": [
        {
          "title": "Roles and permissions in Microsoft Sentinel",
          "url": "https://learn.microsoft.com/azure/sentinel/roles"
        }
      ]
    },
    {
      "id": "q003",
      "type": "multiple_choice",
      "chapter": "ch4",
      "difficulty": "easy",
      "tags": ["KQL"],
      "question": "You are writing Kusto Query Language (KQL) queries in Microsoft Sentinel.\n\nWhich **two** operators can you use to combine rows or columns from two different tables?\n\nEach correct answer presents a complete solution.",
      "options": [
        { "id": "A", "text": "join" },
        { "id": "B", "text": "extend" },
        { "id": "C", "text": "union" },
        { "id": "D", "text": "project" },
        { "id": "E", "text": "summarize" }
      ],
      "answer": ["A", "C"],
      "explanation": "- `join`：依據共同欄位將兩個資料表的資料列「橫向」合併。\n- `union`：將兩個以上資料表的資料列「縱向」串接。\n\n`extend` 新增計算欄位、`project` 選擇欄位、`summarize` 進行彙總，皆只作用於單一輸入資料表。",
      "references": [
        {
          "title": "join operator",
          "url": "https://learn.microsoft.com/kusto/query/join-operator"
        },
        {
          "title": "union operator",
          "url": "https://learn.microsoft.com/kusto/query/union-operator"
        }
      ]
    },
    {
      "id": "q004",
      "type": "multiple_choice",
      "chapter": "ch1",
      "difficulty": "medium",
      "tags": ["Microsoft Sentinel", "SOAR"],
      "question": "You have a Microsoft Sentinel workspace.\n\nWhen a high-severity incident is created, you need to automatically assign the incident to an analyst and post a message to a Microsoft Teams channel.\n\nWhich **two** components should you use?\n\nEach correct answer presents part of the solution.",
      "options": [
        { "id": "A", "text": "An automation rule" },
        { "id": "B", "text": "A playbook" },
        { "id": "C", "text": "A workbook" },
        { "id": "D", "text": "A hunting query" },
        { "id": "E", "text": "A watchlist" }
      ],
      "answer": ["A", "B"],
      "explanation": "**Automation rule** 可在事件建立時依條件觸發，直接執行「指派擁有者」等動作，並可呼叫 **Playbook**。\n\n**Playbook**（以 Azure Logic Apps 為基礎）負責與外部系統整合，例如發送 Teams 訊息。\n\nWorkbook 用於視覺化、Hunting query 用於主動獵捕、Watchlist 用於存放參考資料，皆無法自動回應事件。",
      "references": [
        {
          "title": "Automate threat response with automation rules",
          "url": "https://learn.microsoft.com/azure/sentinel/automate-incident-handling-with-automation-rules"
        }
      ]
    },
    {
      "id": "q005",
      "type": "dropdown_cloze",
      "chapter": "ch4",
      "difficulty": "hard",
      "tags": ["KQL", "Threat Intelligence"],
      "question": "You need to identify devices that executed a file whose SHA-256 hash matches a threat intelligence indicator, and return the number of matching processes per device.\n\nHow should you complete the query? Select the appropriate options in the answer area.",
      "templateType": "code",
      "template": "let MaliciousHashes = ThreatIntelligenceIndicator\n    | where isnotempty(FileHashValue) and FileHashType == \"SHA256\"\n    | project FileHashValue;\nDeviceProcessEvents\n| where TimeGenerated > ago(7d)\n| {{select_0}} kind=inner (MaliciousHashes) on $left.{{select_1}} == $right.FileHashValue\n| {{select_2}} ProcessCount = count() by DeviceName\n| order by ProcessCount desc",
      "blanks": [
        { "id": "select_0", "options": ["join", "union", "extend", "mv-expand"], "answer": "join" },
        { "id": "select_1", "options": ["SHA256", "SHA1", "MD5", "FileName"], "answer": "SHA256" },
        { "id": "select_2", "options": ["summarize", "extend", "project", "render"], "answer": "summarize" }
      ],
      "explanation": "1. `join kind=inner`：只保留兩邊雜湊值相符的資料列。`union` 只會串接資料列、無法依欄位比對；`extend` 與 `mv-expand` 只作用於單一資料表。\n2. 威脅情資已篩選為 `SHA256`，因此左表要比對 `DeviceProcessEvents` 的 `SHA256` 欄位。\n3. `summarize ... count() by DeviceName`：依裝置彙總數量。",
      "references": [
        {
          "title": "DeviceProcessEvents table",
          "url": "https://learn.microsoft.com/defender-xdr/advanced-hunting-deviceprocessevents-table"
        }
      ]
    },
    {
      "id": "q006",
      "type": "dropdown_cloze",
      "chapter": "ch1",
      "difficulty": "medium",
      "tags": ["Microsoft Sentinel", "Data connectors"],
      "question": "Complete the following statements about Microsoft Sentinel by selecting the correct option from each drop-down list.",
      "templateType": "text",
      "template": "To collect Windows Security events from Azure virtual machines by using the Azure Monitor Agent, you should configure {{select_0}}.\n\nTo run a playbook automatically whenever a new incident is created, you should create {{select_1}}.",
      "blanks": [
        {
          "id": "select_0",
          "options": [
            "the Windows Security Events via AMA connector and a data collection rule",
            "the Syslog via AMA connector",
            "a Log Analytics workspace diagnostic setting",
            "the Common Event Format (CEF) via AMA connector"
          ],
          "answer": "the Windows Security Events via AMA connector and a data collection rule"
        },
        {
          "id": "select_1",
          "options": ["an automation rule", "a workbook", "a hunting query", "a watchlist"],
          "answer": "an automation rule"
        }
      ],
      "explanation": "- **Windows Security Events via AMA** 連接器會透過資料收集規則（DCR）指定要收集的 VM 與事件集。Syslog / CEF 用於 Linux 或網路設備。\n- 事件建立時觸發 Playbook 應使用 **automation rule**（觸發條件：When incident is created）。",
      "references": [
        {
          "title": "Windows Security Events via AMA connector",
          "url": "https://learn.microsoft.com/azure/sentinel/data-connectors/windows-security-events-via-ama"
        }
      ]
    },
    {
      "id": "q007",
      "type": "drag_drop_order",
      "chapter": "ch2",
      "difficulty": "medium",
      "tags": ["Defender XDR", "Custom detections"],
      "question": "You need to create a custom detection rule in Microsoft Defender XDR that generates alerts from an advanced hunting query.\n\nWhich **four** actions should you perform in sequence? Move the appropriate actions from the list of actions to the answer area and arrange them in the correct order.",
      "items": [
        { "id": "a", "text": "Run the query in Advanced hunting and verify it returns the required columns (Timestamp, DeviceId, ReportId)" },
        { "id": "b", "text": "Select Create detection rule" },
        { "id": "c", "text": "Configure the alert details, including frequency, severity, and MITRE technique" },
        { "id": "d", "text": "Choose the impacted entities and the automated response actions, then create the rule" },
        { "id": "e", "text": "Create a watchlist in Microsoft Sentinel" },
        { "id": "f", "text": "Enable the Fusion analytics rule" }
      ],
      "answer": ["a", "b", "c", "d"],